[
  {
    "id": "module_01_introduction_to_clinical_trichology_and_hair_restoration_medicine",
    "moduleNumber": 1,
    "title": "Introduction to Clinical Trichology and Hair Restoration Medicine",
    "slug": "introduction-to-clinical-trichology-and-hair-restoration-medicine",
    "volumeNumber": 1,
    "sectionId": "section_volume_1_foundations",
    "sectionTitle": "Foundations of Clinical Trichology",
    "overview": "[Placeholder overview for Module 01]",
    "learningOutcomes": [
      "[Placeholder learning outcome 1 for Module 01]",
      "[Placeholder learning outcome 2 for Module 01]"
    ],
    "competencies": [
      "[Placeholder competency 1 for Module 01]",
      "[Placeholder competency 2 for Module 01]"
    ],
    "estimatedStudyMinutes": 180,
    "unlockOrder": 1,
    "assessmentType": "mixed-knowledge-check"
  },
  {
    "id": "module_02_hair_follicle_biology_and_scalp_science",
    "moduleNumber": 2,
    "title": "Hair Follicle Biology and Scalp Science",
    "slug": "hair-follicle-biology-and-scalp-science",
    "volumeNumber": 1,
    "sectionId": "section_volume_1_foundations",
    "sectionTitle": "Foundations of Clinical Trichology",
    "overview": "[Placeholder overview for Module 02]",
    "learningOutcomes": [
      "[Placeholder learning outcome 1 for Module 02]",
      "[Placeholder learning outcome 2 for Module 02]"
    ],
    "competencies": [
      "[Placeholder competency 1 for Module 02]",
      "[Placeholder competency 2 for Module 02]"
    ],
    "estimatedStudyMinutes": 210,
    "unlockOrder": 2,
    "assessmentType": "image-interpretation-intensive"
  },
  {
    "id": "module_03_molecular_and_hormonal_regulation_of_hair_growth",
    "moduleNumber": 3,
    "title": "Molecular and Hormonal Regulation of Hair Growth",
    "slug": "molecular-and-hormonal-regulation-of-hair-growth",
    "volumeNumber": 1,
    "sectionId": "section_volume_1_foundations",
    "sectionTitle": "Foundations of Clinical Trichology",
    "overview": "[Placeholder overview for Module 03]",
    "learningOutcomes": [
      "[Placeholder learning outcome 1 for Module 03]",
      "[Placeholder learning outcome 2 for Module 03]"
    ],
    "competencies": [
      "[Placeholder competency 1 for Module 03]",
      "[Placeholder competency 2 for Module 03]"
    ],
    "estimatedStudyMinutes": 210,
    "unlockOrder": 3,
    "assessmentType": "mixed-knowledge-check"
  },
  {
    "id": "module_04_clinical_consultation_and_hair_loss_history_taking",
    "moduleNumber": 4,
    "title": "Clinical Consultation and Hair Loss History-Taking",
    "slug": "clinical-consultation-and-hair-loss-history-taking",
    "volumeNumber": 1,
    "sectionId": "section_volume_1_foundations",
    "sectionTitle": "Foundations of Clinical Trichology",
    "overview": "[Placeholder overview for Module 04]",
    "learningOutcomes": [
      "[Placeholder learning outcome 1 for Module 04]",
      "[Placeholder learning outcome 2 for Module 04]"
    ],
    "competencies": [
      "[Placeholder competency 1 for Module 04]",
      "[Placeholder competency 2 for Module 04]"
    ],
    "estimatedStudyMinutes": 180,
    "unlockOrder": 4,
    "assessmentType": "case-reasoning-intensive"
  },
  {
    "id": "module_05_clinical_examination_of_hair_and_scalp",
    "moduleNumber": 5,
    "title": "Clinical Examination of Hair and Scalp",
    "slug": "clinical-examination-of-hair-and-scalp",
    "volumeNumber": 2,
    "sectionId": "section_volume_2_diagnostic_trichology",
    "sectionTitle": "Diagnostic Trichology and Pattern Hair Loss Medicine",
    "overview": "[Placeholder overview for Module 05]",
    "learningOutcomes": [
      "[Placeholder learning outcome 1 for Module 05]",
      "[Placeholder learning outcome 2 for Module 05]"
    ],
    "competencies": [
      "[Placeholder competency 1 for Module 05]",
      "[Placeholder competency 2 for Module 05]"
    ],
    "estimatedStudyMinutes": 210,
    "unlockOrder": 5,
    "assessmentType": "image-interpretation-intensive"
  },
  {
    "id": "module_06_trichoscopy_foundations_to_advanced_interpretation",
    "moduleNumber": 6,
    "title": "Trichoscopy: Foundations to Advanced Interpretation",
    "slug": "trichoscopy-foundations-to-advanced-interpretation",
    "volumeNumber": 2,
    "sectionId": "section_volume_2_diagnostic_trichology",
    "sectionTitle": "Diagnostic Trichology and Pattern Hair Loss Medicine",
    "overview": "[Placeholder overview for Module 06]",
    "learningOutcomes": [
      "[Placeholder learning outcome 1 for Module 06]",
      "[Placeholder learning outcome 2 for Module 06]"
    ],
    "competencies": [
      "[Placeholder competency 1 for Module 06]",
      "[Placeholder competency 2 for Module 06]"
    ],
    "estimatedStudyMinutes": 240,
    "unlockOrder": 6,
    "assessmentType": "image-interpretation-intensive"
  },
  {
    "id": "module_07_laboratory_investigations_endocrine_workup_and_biopsy_logic",
    "moduleNumber": 7,
    "title": "Laboratory Investigations, Endocrine Workup, and Biopsy Logic",
    "slug": "laboratory-investigations-endocrine-workup-and-biopsy-logic",
    "volumeNumber": 2,
    "sectionId": "section_volume_2_diagnostic_trichology",
    "sectionTitle": "Diagnostic Trichology and Pattern Hair Loss Medicine",
    "overview": "[Placeholder overview for Module 07]",
    "learningOutcomes": [
      "[Placeholder learning outcome 1 for Module 07]",
      "[Placeholder learning outcome 2 for Module 07]"
    ],
    "competencies": [
      "[Placeholder competency 1 for Module 07]",
      "[Placeholder competency 2 for Module 07]"
    ],
    "estimatedStudyMinutes": 210,
    "unlockOrder": 7,
    "assessmentType": "case-reasoning-intensive"
  },
  {
    "id": "module_08_androgenetic_alopecia_in_males",
    "moduleNumber": 8,
    "title": "Androgenetic Alopecia in Males",
    "slug": "androgenetic-alopecia-in-males",
    "volumeNumber": 2,
    "sectionId": "section_volume_2_diagnostic_trichology",
    "sectionTitle": "Diagnostic Trichology and Pattern Hair Loss Medicine",
    "overview": "[Placeholder overview for Module 08]",
    "learningOutcomes": [
      "[Placeholder learning outcome 1 for Module 08]",
      "[Placeholder learning outcome 2 for Module 08]"
    ],
    "competencies": [
      "[Placeholder competency 1 for Module 08]",
      "[Placeholder competency 2 for Module 08]"
    ],
    "estimatedStudyMinutes": 210,
    "unlockOrder": 8,
    "assessmentType": "mixed-knowledge-check"
  },
  {
    "id": "module_09_female_pattern_hair_loss_and_hormonal_hair_loss_in_women",
    "moduleNumber": 9,
    "title": "Female Pattern Hair Loss and Hormonal Hair Loss in Women",
    "slug": "female-pattern-hair-loss-and-hormonal-hair-loss-in-women",
    "volumeNumber": 2,
    "sectionId": "section_volume_2_diagnostic_trichology",
    "sectionTitle": "Diagnostic Trichology and Pattern Hair Loss Medicine",
    "overview": "[Placeholder overview for Module 09]",
    "learningOutcomes": [
      "[Placeholder learning outcome 1 for Module 09]",
      "[Placeholder learning outcome 2 for Module 09]"
    ],
    "competencies": [
      "[Placeholder competency 1 for Module 09]",
      "[Placeholder competency 2 for Module 09]"
    ],
    "estimatedStudyMinutes": 210,
    "unlockOrder": 9,
    "assessmentType": "case-reasoning-intensive"
  },
  {
    "id": "module_10_telogen_effluvium_and_diffuse_shedding_disorders",
    "moduleNumber": 10,
    "title": "Telogen Effluvium and Diffuse Shedding Disorders",
    "slug": "telogen-effluvium-and-diffuse-shedding-disorders",
    "volumeNumber": 3,
    "sectionId": "section_volume_3_diffuse_shedding_scalp_disease",
    "sectionTitle": "Diffuse Shedding, Cicatricial Alopecia, and Scalp Disease",
    "overview": "[Placeholder overview for Module 10]",
    "learningOutcomes": [
      "[Placeholder learning outcome 1 for Module 10]",
      "[Placeholder learning outcome 2 for Module 10]"
    ],
    "competencies": [
      "[Placeholder competency 1 for Module 10]",
      "[Placeholder competency 2 for Module 10]"
    ],
    "estimatedStudyMinutes": 210,
    "unlockOrder": 10,
    "assessmentType": "case-reasoning-intensive"
  },
  {
    "id": "module_11_alopecia_areata_and_immune_mediated_hair_loss",
    "moduleNumber": 11,
    "title": "Alopecia Areata and Immune-Mediated Hair Loss",
    "slug": "alopecia-areata-and-immune-mediated-hair-loss",
    "volumeNumber": 3,
    "sectionId": "section_volume_3_diffuse_shedding_scalp_disease",
    "sectionTitle": "Diffuse Shedding, Cicatricial Alopecia, and Scalp Disease",
    "overview": "[Placeholder overview for Module 11]",
    "learningOutcomes": [
      "[Placeholder learning outcome 1 for Module 11]",
      "[Placeholder learning outcome 2 for Module 11]"
    ],
    "competencies": [
      "[Placeholder competency 1 for Module 11]",
      "[Placeholder competency 2 for Module 11]"
    ],
    "estimatedStudyMinutes": 210,
    "unlockOrder": 11,
    "assessmentType": "image-interpretation-intensive"
  },
  {
    "id": "module_12_hair_shaft_disorders_and_breakage_syndromes",
    "moduleNumber": 12,
    "title": "Hair Shaft Disorders and Breakage Syndromes",
    "slug": "hair-shaft-disorders-and-breakage-syndromes",
    "volumeNumber": 3,
    "sectionId": "section_volume_3_diffuse_shedding_scalp_disease",
    "sectionTitle": "Diffuse Shedding, Cicatricial Alopecia, and Scalp Disease",
    "overview": "[Placeholder overview for Module 12]",
    "learningOutcomes": [
      "[Placeholder learning outcome 1 for Module 12]",
      "[Placeholder learning outcome 2 for Module 12]"
    ],
    "competencies": [
      "[Placeholder competency 1 for Module 12]",
      "[Placeholder competency 2 for Module 12]"
    ],
    "estimatedStudyMinutes": 180,
    "unlockOrder": 12,
    "assessmentType": "image-interpretation-intensive"
  },
  {
    "id": "module_13_principles_of_cicatricial_alopecia",
    "moduleNumber": 13,
    "title": "Principles of Cicatricial Alopecia",